{
  "schema_version": 2,
  "category": "differential",
  "models": ["large", "medium", "small"],
  "llvm_sources": ["test.c", "memory.c"],
  "tasking_sources": ["test.c", "memory.c"],
  "driver": "differential",
  "differential": {
    "case_count": 10,
    "seed": 375390536,
    "reference_signature": 1800838867
  },
  "llvm_entry": "_c166_test_case",
  "optimizations": ["O0", "O1", "O2", "O3", "Os", "Oz"],
  "labels": ["abi", "differential", "float", "memory", "object-storage", "runtime-semantics"],
  "runtime_builtins": true,
  "required_symbols": [
    "_c166_test_case", "_double_parameter_word", "_read_first_word", "_store_two",
    "_extended_parameter_word", "___extendsfdf2"
  ],
  "result": {
    "protocol": "block",
    "suite_id": 326,
    "expected_signature": 1567875259
  },
  "simulator_timeout": 90,
  "timeout": 150
}
