{
  "schema_version": 2,
  "category": "stress",
  "models": ["large", "medium", "small"],
  "llvm_sources": ["llvm.c"],
  "tasking_host": "host.c",
  "tasking_sources": [],
  "tasking_asm_sources": [],
  "inputs": ["types.h", "corpus.inc"],
  "llvm_entry": "_llvm_f32_to_i32",
  "optimizations": ["O0", "O1", "O2", "O3", "Os", "Oz"],
  "labels": [
    "conversion", "differential", "float", "integer", "optimization",
    "runtime", "runtime-semantics", "seeded", "stress"
  ],
  "runtime_builtins": true,
  "extra_ldflags": [
    "--section-start=.llvm_f32_to_i32=0x100100",
    "--section-start=.llvm_f32_to_u32=0x100200"
  ],
  "extra_ldflags_by_model": {
    "medium": [
      "--section-start=.llvm_f32_to_i32=0xc100",
      "--section-start=.llvm_f32_to_u32=0xc200",
      "--section-start=.c166.near.text=0xc400"
    ]
  },
  "required_symbols": [
    "_llvm_f32_to_i32", "_llvm_f32_to_u32", "___fixsfsi",
    "___fixunssfsi"
  ],
  "result": {
    "protocol": "block",
    "suite_id": 387,
    "expected_signature": 1182546267
  },
  "simulator_timeout": 480,
  "stress_runs": [{
    "name": "100k",
    "model": "large",
    "optimization": "O2",
    "runner": "tools/run-seeded-stress",
    "arguments": ["f32-to-i32", "O2"],
    "labels": [
      "conversion", "differential", "float", "generated", "integer",
      "runtime", "runner-seed", "stress-100k"
    ],
    "timeout": 1200
  }],
  "timeout": 540
}
