{
  "schema_version": 2,
  "category": "runtime",
  "llvm_sources": ["llvm.c"],
  "tasking_host": "host.c",
  "tasking_sources": [],
  "tasking_asm_sources": [],
  "inputs": ["types.h", "vectors.inc"],
  "llvm_entry": "_llvm_i64_compare_eval",
  "models": ["large", "medium", "small", "tiny", "huge"],
  "optimizations": ["O0", "O1", "O2", "O3", "Os", "Oz"],
  "labels": [
    "integer", "optimization", "runtime", "runtime-semantics", "wide-integer"
  ],
  "runtime_builtins": true,
  "extra_ldflags_by_model": {
    "medium": [
      "--section-start=.llvm_i64_compare_eval=0xc100"
    ]
  },
  "required_symbols": ["_llvm_i64_compare_eval"],
  "result": {
    "protocol": "block",
    "suite_id": 320,
    "expected_signature": 3269770831
  },
  "timeout": 120
}
