{
  "schema_version": 2,
  "category": "abi",
  "models": ["large", "medium", "small", "huge"],
  "llvm_sources": ["llvm.c"],
  "tasking_host": "host.c",
  "tasking_sources": ["tasking.c"],
  "tasking_asm_sources": ["abi-boundary.asm"],
  "inputs": ["types.h", "callee.inc"],
  "llvm_entry": "_llvm_fp_reverse",
  "optimizations": ["O0", "O1", "O2", "O3", "Os", "Oz"],
  "labels": ["abi", "float", "double", "indirect-call", "reverse-call", "optimization"],
  "runtime_builtins": true,
  "extra_ldflags": [
    "--section-start=.llvm_fp_float=0x100100",
    "--section-start=.llvm_fp_double=0x100800",
    "--section-start=.llvm_fp_reverse=0x101000"
  ],
  "extra_ldflags_by_model": {
    "medium": [
      "--section-start=.c166.near.text=0xb200",
      "--section-start=.llvm_fp_float=0xb400",
      "--section-start=.llvm_fp_double=0xbc00",
      "--section-start=.llvm_fp_reverse=0xc400"
    ]
  },
  "required_symbols": ["_llvm_fp_float", "_llvm_fp_double", "_llvm_fp_reverse"],
  "tasking_import_symbols": ["_tasking_fp_float", "_tasking_fp_double"],
  "result": {"protocol": "block", "suite_id": 327, "expected_signature": 3803748353},
  "simulator_timeout": 90,
  "timeout": 150
}
