{
  "schema_version": 2,
  "category": "differential",
  "llvm_sources": [
    "llvm.c",
    "llvm-calls.c"
  ],
  "tasking_host": "host.c",
  "tasking_sources": [
    "tasking_float_roundtrip.c",
    "tasking-float-calls.c",
    "tasking-float-nested.c"
  ],
  "tasking_asm_sources": [
    "abi-boundary.asm"
  ],
  "inputs": [
    "types.h",
    "vectors.inc"
  ],
  "llvm_entry": "_llvm_float32_eval",
  "optimizations": [
    "O0",
    "O1",
    "O2",
    "O3",
    "Os",
    "Oz"
  ],
  "labels": [
    "abi",
    "differential",
    "float",
    "optimization",
    "reverse-call",
    "runtime",
    "runtime-semantics"
  ],
  "runtime_builtins": true,
  "extra_ldflags": [
    "--section-start=.llvm_float32_eval=0x100100",
    "--section-start=.llvm_float32_reverse=0x100900",
    "--section-start=.llvm_float32_load_external=0x101100",
    "--section-start=.llvm_float32_store_external=0x101200",
    "--section-start=.llvm_float32_load_own=0x101300",
    "--section-start=.llvm_float32_store_own=0x101400",
    "--section-start=.llvm_float32_slot0=0x101500",
    "--section-start=.llvm_float32_slot1=0x101600",
    "--section-start=.llvm_float32_slot2=0x101700",
    "--section-start=.llvm_float32_slot3=0x101800",
    "--section-start=.llvm_float32_slot4=0x101900",
    "--section-start=.llvm_float32_call_tasking=0x101a00",
    "--section-start=.llvm_float32_icall_tasking=0x101b00",
    "--section-start=.llvm_float32_cross_tu=0x101c00",
    "--section-start=.llvm_float32_data=0x400000"
  ],
  "required_symbols": [
    "_llvm_float32_eval",
    "_llvm_float32_reverse",
    "_llvm_float32_slot",
    "_llvm_float32_load_external",
    "_llvm_float32_store_external",
    "_llvm_float32_load_own",
    "_llvm_float32_store_own",
    "_llvm_float32_slot0",
    "_llvm_float32_slot1",
    "_llvm_float32_slot2",
    "_llvm_float32_slot3",
    "_llvm_float32_slot4",
    "_llvm_float32_call_tasking",
    "_llvm_float32_icall_tasking",
    "_llvm_float32_cross_tu",
    "_tasking_float_roundtrip",
    "_tasking_float_slot3",
    "_tasking_float_nested_slot3",
    "__icall",
    "___addsf3",
    "___subsf3",
    "___mulsf3",
    "___divsf3"
  ],
  "result": {
    "protocol": "block",
    "suite_id": 286,
    "expected_signature": 2566079802
  },
  "simulator_timeout": 300,
  "timeout": 360,
  "tasking_import_symbols": [
    "_tasking_float_nested_slot3",
    "_tasking_float_roundtrip",
    "_tasking_float_slot",
    "_tasking_float_slot3"
  ]
}
