{
  "schema_version": 2,
  "category": "differential",
  "llvm_sources": [
    "llvm.c",
    "tasking-runtime-entry.S"
  ],
  "tasking_host": "host.c",
  "tasking_sources": [
    "tasking_callee.c"
  ],
  "tasking_asm_sources": [
    "abi-boundary.asm"
  ],
  "inputs": [
    "types.h",
    "vectors.inc"
  ],
  "llvm_entry": "_llvm_tasking_double_identity",
  "optimizations": [
    "O0",
    "O1",
    "O2",
    "O3",
    "Os",
    "Oz"
  ],
  "labels": [
    "abi",
    "double",
    "float",
    "optimization",
    "reverse-call",
    "tasking-runtime-helper"
  ],
  "disassembly_min_counts": [
    {
      "pattern": "mov[[:space:]]+r2, \\[r4\\+\\]",
      "min": 3
    },
    {
      "pattern": "mov[[:space:]]+r2, \\[r10\\+\\]",
      "min": 3
    },
    {
      "pattern": "add[[:space:]]+r10, #2",
      "min": 3
    },
    {
      "pattern": "sub[[:space:]]+r10, #6",
      "min": 1
    }
  ],
  "runtime_builtins": true,
  "extra_ldflags": [
    "--defsym=_llvm_tasking_double_observed=0x400300",
    "--section-start=.llvm_tasking_double_identity=0x100100",
    "--section-start=.tasking_float_entry=0x100500"
  ],
  "required_symbols": [
    "_llvm_tasking_double_identity",
    "_llvm_tasking_double_observed",
    "_tasking_double_identity",
    "__load8n",
    "__ldnoal8n",
    "__store8n",
    "__load8f",
    "__ldnoal8f",
    "__store8f",
    "__cpnnb",
    "__cpnnw",
    "__cpnfb",
    "__cpnfw",
    "__cpfnb",
    "__cpfnw"
  ],
  "result": {
    "protocol": "block",
    "suite_id": 296,
    "expected_signature": 4164564632
  },
  "simulator_timeout": 90,
  "timeout": 150,
  "tasking_import_symbols": [
    "_tasking_double_identity"
  ]
}
