{
  "schema_version": 2,
  "category": "differential",
  "models": ["large", "medium", "small", "huge"],
  "llvm_sources": ["test.c"],
  "driver": "differential",
  "differential": {
    "case_count": 22,
    "seed": 375390535,
    "reference_signature": 2466703227
  },
  "tasking_sources": ["test.c"],
  "tasking_import_symbols": ["_strcmp"],
  "llvm_entry": "_c166_test_case",
  "optimizations": ["O0", "O1", "O2", "O3", "Os", "Oz"],
  "labels": [
    "differential", "memory", "runtime", "runtime-semantics"
  ],
  "runtime_builtins": true,
  "extra_ldflags_by_model": {
    "large": [
      "--section-start=.memory.page_a=0x410800",
      "--section-start=.memory.page_b=0x414800"
    ],
    "medium": [
      "--section-start=.memory.page_a=0x410800",
      "--section-start=.memory.page_b=0x414800"
    ],
    "small": []
  },
  "required_symbols": [
    "_c166_test_case", "_memcpy", "_memmove", "_memset", "_strcmp"
  ],
  "result": {
    "protocol": "block",
    "suite_id": 325,
    "expected_signature": 37571965
  },
  "simulator_timeout": 90,
  "timeout": 150
}
