{
  "schema_version": 2,
  "category": "differential",
  "models": ["large", "medium", "small", "tiny", "huge"],
  "source_case": "code-size-corpus",
  "llvm_sources": ["test.c"],
  "driver": "differential",
  "differential": {
    "case_count": 10,
    "seed": 375390533,
    "reference_signature": 3661311263
  },
  "tasking_sources": ["test.c"],
  "project_sources": [
    "size/benchmarks/double-arithmetic.c",
    "size/benchmarks/double-comparison.c",
    "size/benchmarks/float-arithmetic.c",
    "size/benchmarks/integer-to-double.c"
  ],
  "llvm_entry": "_c166_test_case",
  "optimizations": ["Os"],
  "labels": [
    "codegen", "comparison", "differential", "float", "runtime-semantics",
    "size"
  ],
  "runtime_builtins": true,
  "extra_ldflags_by_model": {
    "medium": ["--section-start=.c166.near.text=0xb800"]
  },
  "defines": ["SIZE_CORPUS_FLOATING_ONLY=1"],
  "required_symbols": [
    "_c166_test_case",
    "_size_double_arithmetic",
    "_size_double_comparison",
    "_size_float_arithmetic",
    "_size_signed_to_double",
    "_size_unsigned_to_double"
  ],
  "result": {
    "protocol": "block",
    "suite_id": 325,
    "expected_signature": 3309314072
  },
  "simulator_timeout": 240,
  "timeout": 300
}
