{
  "schema_version": 2,
  "category": "codegen",
  "models": ["large", "medium", "small", "huge"],
  "llvm_sources": ["llvm.c"],
  "tasking_host": "host.c",
  "tasking_sources": [],
  "llvm_entry": "_llvm_entry",
  "optimizations": ["O2"],
  "labels": ["abi", "aggregate"],
  "runtime_builtins": false,
  "required_symbols": ["_llvm_entry"],
  "result": {"protocol": "scalar", "expected_value": 136},
  "timeout": 60
}
