{
  "schema_version": 2,
  "category": "differential",
  "llvm_sources": [
    "llvm.c"
  ],
  "tasking_host": "host.c",
  "tasking_sources": [],
  "tasking_asm_sources": [
    "abi-boundary.asm"
  ],
  "inputs": [
    "types.h",
    "vectors.inc"
  ],
  "llvm_entry": "_llvm_float64_storage_eval",
  "optimizations": [
    "O0",
    "O1",
    "O2",
    "O3",
    "Os",
    "Oz"
  ],
  "labels": [
    "abi",
    "aggregate",
    "array",
    "differential",
    "float",
    "memory",
    "object-storage",
    "optimization",
    "runtime-semantics",
    "union"
  ],
  "runtime_builtins": true,
  "extra_ldflags": [
    "--section-start=.llvm_float64_storage_data=0x400200",
    "--section-start=.llvm_float64_storage_eval=0x100100"
  ],
  "required_symbols": [
    "_llvm_float64_storage_eval",
    "_llvm_double_array",
    "_llvm_double_record",
    "_tasking_double_array",
    "_tasking_double_record_src",
    "_tasking_double_record_dst"
  ],
  "result": {
    "protocol": "block",
    "suite_id": 293,
    "expected_signature": 32440027
  },
  "simulator_timeout": 300,
  "timeout": 360,
  "tasking_import_symbols": [
    "_tasking_double_array",
    "_tasking_double_record_dst",
    "_tasking_double_record_src"
  ]
}
