{
  "schema_version": 2,
  "category": "codegen",
  "models": ["large", "medium", "small", "huge"],
  "llvm_sources": ["test.S"],
  "tasking_host": "host.c",
  "tasking_variants": ["ext", "ext2"],
  "tasking_sources": [],
  "tasking_asm_sources": ["vectors.asm"],
  "llvm_entry": "_test_trap",
  "optimizations": ["O2"],
  "labels": ["asm", "interrupt", "system-stack"],
  "runtime_builtins": false,
  "extra_ldflags": ["--section-start=.c166.interrupt.text=0x190000"],
  "required_symbols": ["_test_trap", "_trap_handler"],
  "result": {
    "protocol": "block",
    "suite_id": 375,
    "expected_signature": 100665190
  },
  "simulator_timeout": 90,
  "timeout": 150
}
